{
  "schema_version": "1",
  "exported_at": "2026-10-12T09:30:00Z",
  "exported_by": "jkowalski",
  "loadable": true,
  "content_sha256": "885d9a7d767af484f1c1824b5d493b9ddc19604db05eff1fa4fbded25bad7497",
  "machine": {
    "code": "M12",
    "name": "Filler 2",
    "plc_platform": "S7_300"
  },
  "recipe": {
    "reference_number": "R-100",
    "name": "Bottle 0.5 l"
  },
  "version": {
    "number": 3,
    "status": "Approved",
    "approved_at": "2026-10-11T14:02:10Z",
    "approved_by": "anowak"
  },
  "types": [
    {
      "id": "5d2c7b1e-3f4a-4b6c-8d9e-1a2b3c4d5e6f",
      "name": "STRING",
      "revision": 1,
      "kind": "Primitive",
      "string_length": 16
    },
    {
      "id": "7c1e9d0a-2b3f-4c4d-9e8f-0a1b2c3d4e5f",
      "name": "ZoneTemp",
      "revision": 2,
      "kind": "Struct",
      "string_length": null,
      "members": [
        {
          "name": "setpoint",
          "type_id": "REAL"
        },
        {
          "name": "label",
          "type_id": "5d2c7b1e-3f4a-4b6c-8d9e-1a2b3c4d5e6f"
        }
      ]
    }
  ],
  "parameters": [
    {
      "unit_path": "U1",
      "tag": "SPEED",
      "key": "1f3a6b2c-8d9e-4f00-a1b2-c3d4e5f60718",
      "name_en": "Line speed",
      "type_id": "INT",
      "s7_address": "DB1.DBW0",
      "limits": [
        {
          "leaf_path": "",
          "min": "10",
          "max": "250",
          "max_length": null
        }
      ],
      "value": "120"
    },
    {
      "unit_path": "U1.2",
      "tag": "ZONE1",
      "key": "9a8b7c6d-5e4f-4321-b0a9-8f7e6d5c4b3a",
      "name_en": "Zone 1",
      "type_id": "7c1e9d0a-2b3f-4c4d-9e8f-0a1b2c3d4e5f",
      "s7_address": "DB1.DBB2",
      "limits": [
        {
          "leaf_path": ".label",
          "min": null,
          "max": null,
          "max_length": "16"
        },
        {
          "leaf_path": ".setpoint",
          "min": "20",
          "max": "95",
          "max_length": null
        }
      ],
      "value": {
        "setpoint": "72.5",
        "label": "Z1"
      }
    }
  ]
}