{
  "schema_version": "1",
  "exported_at": "2026-10-20T07:15:42Z",
  "exported_by": "jkowalski",
  "loadable": false,
  "content_sha256": "71c327a07024fc22955f027c2f1c480170f0de68304c132ead7936ad13c4581c",
  "machine": {
    "code": "M12",
    "name": "Filler 2",
    "plc_platform": "S7_300"
  },
  "recipe": {
    "reference_number": "R-100",
    "name": "Bottle 0.5 l"
  },
  "version": {
    "number": 2,
    "status": "Retired",
    "approved_at": "2026-09-30T11:00:00Z",
    "approved_by": "anowak"
  },
  "types": [
    {
      "id": "9e8d7c6b-5a4f-4e3d-8c2b-1a0f9e8d7c6b",
      "name": null,
      "revision": 1,
      "kind": "Array",
      "string_length": null,
      "element_type_id": "INT",
      "dimensions": [
        {
          "lower": 1,
          "upper": 3
        }
      ]
    }
  ],
  "parameters": [
    {
      "unit_path": "U1",
      "tag": "FILL_STEPS",
      "key": "2b4d6f80-1a3c-4e5f-8a9b-0c1d2e3f4a5b",
      "name_en": "Fill steps",
      "type_id": "9e8d7c6b-5a4f-4e3d-8c2b-1a0f9e8d7c6b",
      "s7_address": "DB2.DBB0",
      "limits": [
        {
          "leaf_path": "[*]",
          "min": "0",
          "max": "100",
          "max_length": null
        }
      ],
      "value": [
        "10",
        "20",
        "30"
      ]
    }
  ]
}